drop table if exists table_null_t1, table_null_t2;
CREATE TABLE table_null_t1 (
indexed_field int default NULL,
KEY indexed_field (indexed_field)
);
INSERT INTO table_null_t1 VALUES (NULL),(NULL);
SELECT * FROM table_null_t1 WHERE indexed_field=NULL;
indexed_field
SELECT * FROM table_null_t1 WHERE indexed_field IS NULL;
indexed_field
NULL
NULL
SELECT * FROM table_null_t1 WHERE indexed_field<=>NULL;
indexed_field
NULL
NULL
DROP TABLE table_null_t1;
create table table_null_t1 (a int, b int) ;
insert into table_null_t1 values(20,null);
select table_null_t2.b, ifnull(table_null_t2.b,"this is null") from table_null_t1 as table_null_t2 left join table_null_t1 as t3 on
table_null_t2.b=t3.a;
b	ifnull(table_null_t2.b,"this is null")
NULL	this is null
select table_null_t2.b, ifnull(table_null_t2.b,"this is null") from table_null_t1 as table_null_t2 left join table_null_t1 as t3 on table_null_t2.b=t3.a order by 1;
b	ifnull(table_null_t2.b,"this is null")
NULL	this is null
insert into table_null_t1 values(10,null);
select table_null_t2.b, ifnull(table_null_t2.b,"this is null") from table_null_t1 as table_null_t2 left join table_null_t1 as t3 on table_null_t2.b=t3.a order by 1;
b	ifnull(table_null_t2.b,"this is null")
NULL	this is null
NULL	this is null
update table_null_t1 set a = -10 where b is null;
select * from table_null_t1 order by a;
a	b
-10	NULL
-10	NULL
delete from table_null_t1 where a > 0;
select * from table_null_t1 order by a;
a	b
-10	NULL
-10	NULL
drop table table_null_t1;
set sql_mode = 'NO_ENGINE_SUBSTITUTION';
Warnings:
Warning	3090	Changing sql mode 'NO_AUTO_CREATE_USER' is deprecated. It will be removed in a future release.
create table table_null_t1 (a varchar(16) not null default '', b smallint(6) not null default 0, c smallint(6) NOT NULL default 0);
INSERT INTO table_null_t1 SET a = "", c= 1;
INSERT INTO table_null_t1 (a) values (null);
ERROR 23000: Column 'a' cannot be null
INSERT INTO table_null_t1 (a) values (1/null);
ERROR 23000: Column 'a' cannot be null
INSERT INTO table_null_t1 (b) values (null);
ERROR 23000: Column 'b' cannot be null
INSERT INTO table_null_t1 (b) values (1/null);
ERROR 23000: Column 'b' cannot be null
INSERT INTO table_null_t1 (c) values (null);
ERROR 23000: Column 'c' cannot be null
INSERT INTO table_null_t1 (c) values (1/null);
ERROR 23000: Column 'c' cannot be null
select * from table_null_t1;
a	b	c
	0	1
drop table table_null_t1;
SET sql_mode = default;
create table table_null_t1 (a int not null, b int not null, index idx(a));
insert into table_null_t1 values
(1,1), (2,2), (3,3), (4,4), (5,5), (6,6),
(7,7), (8,8), (9,9), (10,10), (11,11), (12,12);
select * from table_null_t1 where a between 2 and 3 order by a;
a	b
2	2
3	3
select * from table_null_t1 where a between 2 and 3 or b is null order by a;
a	b
2	2
3	3
drop table table_null_t1;
select cast(NULL as signed);
cast(NULL as signed)
NULL
set names latin2;
create table table_null_t1 select
null as c00,
if(1, null, 'string') as c01,
if(0, null, 'string') as c02,
ifnull(null, 'string') as c03,
ifnull('string', null) as c04,
case when 0 then null else 'string' end as c05,
case when 1 then null else 'string' end as c06,
coalesce(null, 'string') as c07,
coalesce('string', null) as c08,
least('string',null) as c09,
least(null, 'string') as c10,
greatest('string',null) as c11,
greatest(null, 'string') as c12,
nullif('string', null) as c13,
nullif(null, 'string') as c14,
trim('string' from null) as c15,
trim(null from 'string') as c16,
substring_index('string', null, 1) as c17,
substring_index(null, 'string', 1) as c18,
elt(1, null, 'string') as c19,
elt(1, 'string', null) as c20,
concat('string', null) as c21,
concat(null, 'string') as c22,
concat_ws('sep', 'string', null) as c23,
concat_ws('sep', null, 'string') as c24,
concat_ws(null, 'string', 'string') as c25,
make_set(3, 'string', null) as c26,
make_set(3, null, 'string') as c27,
export_set(3, null, 'off', 'sep') as c29,
export_set(3, 'on', null, 'sep') as c30,
export_set(3, 'on', 'off', null) as c31,
replace(null, 'from', 'to') as c32,
replace('str', null, 'to') as c33,
replace('str', 'from', null) as c34,
insert('str', 1, 2, null) as c35,
insert(null, 1, 2, 'str') as c36,
lpad('str', 10, null) as c37,
rpad(null, 10, 'str') as c38;
show create table table_null_t1;
Table	Create Table
table_null_t1	CREATE TABLE `table_null_t1` (
  `c00` binary(0) DEFAULT NULL,
  `c01` varchar(6) CHARACTER SET latin2 DEFAULT NULL,
  `c02` varchar(6) CHARACTER SET latin2 DEFAULT NULL,
  `c03` varchar(6) CHARACTER SET latin2 NOT NULL DEFAULT '',
  `c04` varchar(6) CHARACTER SET latin2 DEFAULT NULL,
  `c05` varchar(6) CHARACTER SET latin2 DEFAULT NULL,
  `c06` varchar(6) CHARACTER SET latin2 DEFAULT NULL,
  `c07` varchar(6) CHARACTER SET latin2 DEFAULT NULL,
  `c08` varchar(6) CHARACTER SET latin2 DEFAULT NULL,
  `c09` varchar(6) CHARACTER SET latin2 DEFAULT NULL,
  `c10` varchar(6) CHARACTER SET latin2 DEFAULT NULL,
  `c11` varchar(6) CHARACTER SET latin2 DEFAULT NULL,
  `c12` varchar(6) CHARACTER SET latin2 DEFAULT NULL,
  `c13` varchar(6) CHARACTER SET latin2 DEFAULT NULL,
  `c14` char(0) CHARACTER SET latin2 DEFAULT NULL,
  `c15` char(0) CHARACTER SET latin2 DEFAULT NULL,
  `c16` varchar(6) CHARACTER SET latin2 DEFAULT NULL,
  `c17` varchar(6) CHARACTER SET latin2 DEFAULT NULL,
  `c18` char(0) CHARACTER SET latin2 DEFAULT NULL,
  `c19` varchar(6) CHARACTER SET latin2 DEFAULT NULL,
  `c20` varchar(6) CHARACTER SET latin2 DEFAULT NULL,
  `c21` varchar(6) CHARACTER SET latin2 DEFAULT NULL,
  `c22` varchar(6) CHARACTER SET latin2 DEFAULT NULL,
  `c23` varchar(9) CHARACTER SET latin2 DEFAULT NULL,
  `c24` varchar(9) CHARACTER SET latin2 DEFAULT NULL,
  `c25` varchar(12) CHARACTER SET latin2 DEFAULT NULL,
  `c26` varchar(7) CHARACTER SET latin2 DEFAULT NULL,
  `c27` varchar(7) CHARACTER SET latin2 DEFAULT NULL,
  `c29` varchar(381) CHARACTER SET latin2 DEFAULT NULL,
  `c30` varchar(317) CHARACTER SET latin2 DEFAULT NULL,
  `c31` varchar(192) CHARACTER SET latin2 DEFAULT NULL,
  `c32` char(0) CHARACTER SET latin2 DEFAULT NULL,
  `c33` varchar(3) CHARACTER SET latin2 DEFAULT NULL,
  `c34` varchar(3) CHARACTER SET latin2 DEFAULT NULL,
  `c35` varchar(3) CHARACTER SET latin2 DEFAULT NULL,
  `c36` varchar(3) CHARACTER SET latin2 DEFAULT NULL,
  `c37` varchar(10) CHARACTER SET latin2 DEFAULT NULL,
  `c38` varchar(10) CHARACTER SET latin2 DEFAULT NULL
) ENGINE=SEQUOIADB DEFAULT CHARSET=latin1
drop table table_null_t1;
#
# Bug #31471: decimal_bin_size: Assertion `scale >= 0 &&
#             precision > 0 && scale <= precision'
#
CREATE TABLE table_null_t1 (a DECIMAL (1, 0) ZEROFILL, b DECIMAL (1, 0) ZEROFILL);
INSERT INTO table_null_t1 (a, b) VALUES (0, 0);
CREATE TABLE table_null_t2 SELECT IFNULL(a, b) FROM table_null_t1;
DESCRIBE table_null_t2;
Field	Type	Null	Key	Default	Extra
IFNULL(a, b)	decimal(1,0) unsigned	YES		NULL	
DROP TABLE table_null_t2;
CREATE TABLE table_null_t2 SELECT IFNULL(a, NULL) FROM table_null_t1;
DESCRIBE table_null_t2;
Field	Type	Null	Key	Default	Extra
IFNULL(a, NULL)	decimal(1,0) unsigned	YES		NULL	
DROP TABLE table_null_t2;
CREATE TABLE table_null_t2 SELECT IFNULL(NULL, b) FROM table_null_t1;
DESCRIBE table_null_t2;
Field	Type	Null	Key	Default	Extra
IFNULL(NULL, b)	decimal(1,0) unsigned	YES		NULL	
DROP TABLE table_null_t1, table_null_t2;
# End of 5.0 tests
