drop table if exists table_varchar_t1, table_varchar_t2;
create table table_varchar_t1 (v varchar(30));
show create table table_varchar_t1;
Table	Create Table
table_varchar_t1	CREATE TABLE `table_varchar_t1` (
  `v` varchar(30) DEFAULT NULL
) ENGINE=SEQUOIADB DEFAULT CHARSET=latin1
insert into table_varchar_t1 values ('abc');
insert into table_varchar_t1 values ('abc ');
insert into table_varchar_t1 values ('abc    ');
select length(v) from table_varchar_t1;
length(v)
3
4
7
drop table table_varchar_t1;
create table table_varchar_t1 (v varchar(20));
insert into table_varchar_t1 values('a ');
select v='a' from table_varchar_t1;
v='a'
1
select binary v='a' from table_varchar_t1;
binary v='a'
0
select binary v='a ' from table_varchar_t1;
binary v='a '
1
insert into table_varchar_t1 values('a');
alter table table_varchar_t1 add primary key (v);
drop table table_varchar_t1;
create table table_varchar_t1 (v varbinary(20));
insert into table_varchar_t1 values('a');
insert into table_varchar_t1 values('a ');
alter table table_varchar_t1 add primary key (v);
drop table table_varchar_t1;
create table table_varchar_t1 (v varchar(254), index (v));
insert into table_varchar_t1 values ("This is a test ");
insert into table_varchar_t1 values ("Some sample data");
insert into table_varchar_t1 values (" garbage ");
insert into table_varchar_t1 values (" This is a test ");
insert into table_varchar_t1 values ("This is a test");
insert into table_varchar_t1 values ("Hello world");
insert into table_varchar_t1 values ("Foo bar");
insert into table_varchar_t1 values ("This is a test");
insert into table_varchar_t1 values ("MySQL varchar test");
insert into table_varchar_t1 values ("test MySQL varchar");
insert into table_varchar_t1 values ("This is a long string to have some random length data included");
insert into table_varchar_t1 values ("Short string");
insert into table_varchar_t1 values ("VSS");
insert into table_varchar_t1 values ("Some samples");
insert into table_varchar_t1 values ("Bar foo");
insert into table_varchar_t1 values ("Bye");
insert into table_varchar_t1 values ("中文");
insert into table_varchar_t1 values ("aaaaaaaaaaaaaaaaaaaaaaaaaaaaaaaaaaaaaaaaaaaaaaaaaaaaaaaaaaaaaaaaaaaaaaaaaaaaaaaaaaaaaaaaaaaaaaaaaaaaaaaaaaaaaaaaaaaaaaaaaaaaaaaaaaaaaaaaaaaaaaaaaaaaaaaaaaaaaaaaaaaaaaaaaaaaaaaaaaaaaaaaaaaaaaaaaaaaaaaaaaaaaaaaaaaaaaaaaaaaaaaaaaaaaaaaaaaaaaaaaaaaaaaaaaaaaaaaaaaaaaaaaaaaaaaaaaaaaaaaaaaaaaaa");
ERROR 22001: Data too long for column 'v' at row 1
select * from table_varchar_t1 where v like 'This is a test' order by v;
v
select * from table_varchar_t1 where v='This is a test' order by v;
v
This is a test
This is a test
This is a test 
select * from table_varchar_t1 where v like 'S%' order by v;
v
Short string
Some sample data
Some samples
drop table table_varchar_t1;
create table table_varchar_t1 (pkcol varchar(16), othercol varchar(16), primary key (pkcol));
insert into table_varchar_t1 values ('test', 'something'),('testing', 'otherthing');
update table_varchar_t1 set othercol='somethingelse' where pkcol='test';
select * from table_varchar_t1;
pkcol	othercol
test	somethingelse
testing	otherthing
delete from table_varchar_t1 where othercol = 'otherthing';
drop table table_varchar_t1;
create table table_varchar_t1 (a int, b varchar(12));
insert into table_varchar_t1 values (1, 'A'), (22, NULL);
create table table_varchar_t2 (a int);
insert into table_varchar_t2 values (22), (22);
select table_varchar_t1.a, table_varchar_t1.b, min(table_varchar_t1.b) from table_varchar_t1 inner join table_varchar_t2 ON table_varchar_t2.a = table_varchar_t1.a group by table_varchar_t1.b, table_varchar_t1.a;
a	b	min(table_varchar_t1.b)
22	NULL	NULL
drop table table_varchar_t1, table_varchar_t2;
DROP TABLE IF EXISTS table_varchar_t1;
CREATE TABLE table_varchar_t1(f1 VARCHAR(100) DEFAULT 'test');
INSERT INTO table_varchar_t1 VALUES(SUBSTR(f1, 1, 3));
DROP TABLE IF EXISTS table_varchar_t1;
CREATE TABLE table_varchar_t1(f1 CHAR(100) DEFAULT 'test');
INSERT INTO table_varchar_t1 VALUES(SUBSTR(f1, 1, 3));
DROP TABLE IF EXISTS table_varchar_t1;
CREATE TABLE table_varchar_t1 (a CHAR(2));
INSERT INTO table_varchar_t1 VALUES (10), (50), (30), ('1a'), (60), ('t');
SELECT a,(a + 0) FROM table_varchar_t1 ORDER BY a;
a	(a + 0)
10	10
1a	1
30	30
50	50
60	60
t	0
Warnings:
Warning	1292	Truncated incorrect DOUBLE value: '1a'
Warning	1292	Truncated incorrect DOUBLE value: 't '
SELECT a,(a DIV 2) FROM table_varchar_t1 ORDER BY a;
a	(a DIV 2)
10	5
1a	0
30	15
50	25
60	30
t	0
Warnings:
Warning	1292	Truncated incorrect DECIMAL value: '1a'
Warning	1366	Incorrect DECIMAL value: '0' for column '' at row -1
Warning	1292	Truncated incorrect DECIMAL value: 't '
SELECT a,CAST(a AS SIGNED) FROM table_varchar_t1 ORDER BY a;
a	CAST(a AS SIGNED)
10	10
1a	1
30	30
50	50
60	60
t	0
Warnings:
Warning	1292	Truncated incorrect INTEGER value: '1a'
Warning	1292	Truncated incorrect INTEGER value: 't'
DROP TABLE table_varchar_t1;
CREATE TABLE table_varchar_t1 (a VARCHAR(16));
INSERT INTO table_varchar_t1 VALUES ('5'), ('s'), ('');
SELECT 5 = a FROM table_varchar_t1;
5 = a
1
0
0
Warnings:
Warning	1292	Truncated incorrect DOUBLE value: 's'
DROP TABLE table_varchar_t1;
CREATE TABLE table_varchar_t1 (a CHAR(16));
INSERT INTO table_varchar_t1 VALUES ('5'), ('s'), ('');
SELECT 5 = a FROM table_varchar_t1;
5 = a
1
0
0
Warnings:
Warning	1292	Truncated incorrect DOUBLE value: 's               '
DROP TABLE table_varchar_t1;
