drop table if exists table_mint_t1;
SET SQL_WARNINGS=1;
create table table_mint_t1 (a mediumint, b mediumint unsigned);
insert into table_mint_t1 values (-8388608,0);
insert into table_mint_t1 values (0,0);
insert into table_mint_t1 values (8388607,16777215);
insert into table_mint_t1 values ('abcd','abcd');
ERROR HY000: Incorrect integer value: 'abcd' for column 'a' at row 1
insert into table_mint_t1 values (-8388609,0);
ERROR 22003: Out of range value for column 'a' at row 1
insert into table_mint_t1 values (0,16777216);
ERROR 22003: Out of range value for column 'b' at row 1
select * from table_mint_t1 order by a;
a	b
-8388608	0
0	0
8388607	16777215
update table_mint_t1 set a = -999999 where a <= 0 and b >= 0;
select * from table_mint_t1 order by a;
a	b
-999999	0
-999999	0
8388607	16777215
delete from table_mint_t1 where b >= 0;
select * from table_mint_t1 order by b;
a	b
drop table table_mint_t1;
