drop table if exists table_timestamp_t1,table_timestamp_t2,table_timestamp_t3,table_timestamp_t4;
SET sql_mode = 'NO_ENGINE_SUBSTITUTION';
Warnings:
Warning	3090	Changing sql mode 'NO_AUTO_CREATE_USER' is deprecated. It will be removed in a future release.
set time_zone="+03:00";
SET TIMESTAMP=1234;
CREATE TABLE table_timestamp_t1 (value TEXT NOT NULL, id VARCHAR(32) NOT NULL, stamp timestamp NOT NULL DEFAULT CURRENT_TIMESTAMP ON UPDATE CURRENT_TIMESTAMP);
INSERT INTO table_timestamp_t1 VALUES ("my value", "myKey","1999-04-02 00:00:00");
SELECT stamp FROM table_timestamp_t1 WHERE id="myKey";
stamp
1999-04-02 00:00:00
UPDATE table_timestamp_t1 SET value="my value" WHERE id="myKey";
SELECT stamp FROM table_timestamp_t1 WHERE id="myKey";
stamp
1999-04-02 00:00:00
UPDATE table_timestamp_t1 SET id="myKey" WHERE value="my value";
SELECT stamp FROM table_timestamp_t1 WHERE id="myKey";
stamp
1999-04-02 00:00:00
drop table table_timestamp_t1;
create table table_timestamp_t1 (a timestamp NOT NULL DEFAULT CURRENT_TIMESTAMP ON UPDATE CURRENT_TIMESTAMP);
insert into table_timestamp_t1 values (now());
select date_format(a,"%Y %y"),year(a),year(now()) from table_timestamp_t1;
date_format(a,"%Y %y")	year(a)	year(now())
1970 70	1970	1970
drop table table_timestamp_t1;
create table table_timestamp_t1 (ix timestamp NOT NULL DEFAULT CURRENT_TIMESTAMP ON UPDATE CURRENT_TIMESTAMP);
insert into table_timestamp_t1 values (19991101000000),(19990102030405),(19990630232922),(19990601000000),(19990930232922),(19990531232922),(19990501000000),(19991101000000),(19990501000000);
select ix+0 from table_timestamp_t1 order by ix;
ix+0
19990102030405
19990501000000
19990501000000
19990531232922
19990601000000
19990630232922
19990930232922
19991101000000
19991101000000
truncate table table_timestamp_t1;
insert into table_timestamp_t1 values ("19991101000000"),("19990102030405"),("19990630232922"),("19990601000000");
select ix+0 from table_timestamp_t1 order by ix;
ix+0
19990102030405
19990601000000
19990630232922
19991101000000
drop table table_timestamp_t1;
CREATE TABLE table_timestamp_t1 (date date, date_time datetime, time_stamp timestamp NOT NULL DEFAULT CURRENT_TIMESTAMP ON UPDATE CURRENT_TIMESTAMP);
INSERT INTO table_timestamp_t1 VALUES ("1998-12-31","1998-12-31 23:59:59",19981231235959);
INSERT INTO table_timestamp_t1 VALUES ("1999-01-01","1999-01-01 00:00:00",19990101000000);
INSERT INTO table_timestamp_t1 VALUES ("1999-09-09","1999-09-09 23:59:59",19990909235959);
INSERT INTO table_timestamp_t1 VALUES ("2000-01-01","2000-01-01 00:00:00",20000101000000);
INSERT INTO table_timestamp_t1 VALUES ("2000-02-28","2000-02-28 00:00:00",20000228000000);
INSERT INTO table_timestamp_t1 VALUES ("2000-02-29","2000-02-29 00:00:00",20000229000000);
INSERT INTO table_timestamp_t1 VALUES ("2000-03-01","2000-03-01 00:00:00",20000301000000);
INSERT INTO table_timestamp_t1 VALUES ("2000-12-31","2000-12-31 23:59:59",20001231235959);
INSERT INTO table_timestamp_t1 VALUES ("2001-01-01","2001-01-01 00:00:00",20010101000000);
INSERT INTO table_timestamp_t1 VALUES ("2004-12-31","2004-12-31 23:59:59",20041231235959);
INSERT INTO table_timestamp_t1 VALUES ("2005-01-01","2005-01-01 00:00:00",20050101000000);
INSERT INTO table_timestamp_t1 VALUES ("2030-01-01","2030-01-01 00:00:00",20300101000000);
SELECT * FROM table_timestamp_t1 order by time_stamp;
date	date_time	time_stamp
1998-12-31	1998-12-31 23:59:59	1998-12-31 23:59:59
1999-01-01	1999-01-01 00:00:00	1999-01-01 00:00:00
1999-09-09	1999-09-09 23:59:59	1999-09-09 23:59:59
2000-01-01	2000-01-01 00:00:00	2000-01-01 00:00:00
2000-02-28	2000-02-28 00:00:00	2000-02-28 00:00:00
2000-02-29	2000-02-29 00:00:00	2000-02-29 00:00:00
2000-03-01	2000-03-01 00:00:00	2000-03-01 00:00:00
2000-12-31	2000-12-31 23:59:59	2000-12-31 23:59:59
2001-01-01	2001-01-01 00:00:00	2001-01-01 00:00:00
2004-12-31	2004-12-31 23:59:59	2004-12-31 23:59:59
2005-01-01	2005-01-01 00:00:00	2005-01-01 00:00:00
2030-01-01	2030-01-01 00:00:00	2030-01-01 00:00:00
drop table table_timestamp_t1;
create table table_timestamp_t1 (ix timestamp NOT NULL DEFAULT CURRENT_TIMESTAMP ON UPDATE CURRENT_TIMESTAMP);
insert into table_timestamp_t1 values (0),(20030101010160),(20030101016001),(20030101240101),(20030132010101),(20031301010101),(20031200000000),(20030000000000);
Warnings:
Warning	1265	Data truncated for column 'ix' at row 2
Warning	1265	Data truncated for column 'ix' at row 3
Warning	1265	Data truncated for column 'ix' at row 4
Warning	1265	Data truncated for column 'ix' at row 5
Warning	1265	Data truncated for column 'ix' at row 6
Warning	1265	Data truncated for column 'ix' at row 7
Warning	1265	Data truncated for column 'ix' at row 8
select ix+0 from table_timestamp_t1;
ix+0
0
0
0
0
0
0
0
0
truncate table table_timestamp_t1;
insert into table_timestamp_t1 values ("00000000000000"),("20030101010160"),("20030101016001"),("20030101240101"),("20030132010101"),("20031301010101"),("20031200000000"),("20030000000000");
Warnings:
Warning	1265	Data truncated for column 'ix' at row 2
Warning	1265	Data truncated for column 'ix' at row 3
Warning	1265	Data truncated for column 'ix' at row 4
Warning	1265	Data truncated for column 'ix' at row 5
Warning	1265	Data truncated for column 'ix' at row 6
Warning	1264	Out of range value for column 'ix' at row 7
Warning	1264	Out of range value for column 'ix' at row 8
select ix+0 from table_timestamp_t1 order by ix;
ix+0
0
0
0
0
0
0
0
0
truncate table table_timestamp_t1;
insert into table_timestamp_t1 values ("0000-00-00 00:00:00 some trailer"),("2003-01-01 00:00:00 some trailer");
Warnings:
Warning	1265	Data truncated for column 'ix' at row 1
Warning	1265	Data truncated for column 'ix' at row 2
select ix+0 from table_timestamp_t1 order by ix;
ix+0
0
20030101000000
drop table table_timestamp_t1;
create table table_timestamp_t1 (table_timestamp_t1 timestamp not null default now(), table_timestamp_t2 datetime, table_timestamp_t3 timestamp NOT NULL DEFAULT '0000-00-00 00:00:00');
SET TIMESTAMP=1000000002;
insert into table_timestamp_t1 values ();
SET TIMESTAMP=1000000003;
update table_timestamp_t1 set table_timestamp_t2=now();
SET TIMESTAMP=1000000003;
insert into table_timestamp_t1 (table_timestamp_t1,table_timestamp_t3) values (default, default);
select * from table_timestamp_t1 order by table_timestamp_t1;
table_timestamp_t1	table_timestamp_t2	table_timestamp_t3
2001-09-09 04:46:42	2001-09-09 04:46:43	0000-00-00 00:00:00
2001-09-09 04:46:43	NULL	0000-00-00 00:00:00
show create table table_timestamp_t1;
Table	Create Table
table_timestamp_t1	CREATE TABLE `table_timestamp_t1` (
  `table_timestamp_t1` timestamp NOT NULL DEFAULT CURRENT_TIMESTAMP,
  `table_timestamp_t2` datetime DEFAULT NULL,
  `table_timestamp_t3` timestamp NOT NULL DEFAULT '0000-00-00 00:00:00'
) ENGINE=SEQUOIADB DEFAULT CHARSET=latin1
show columns from table_timestamp_t1;
Field	Type	Null	Key	Default	Extra
table_timestamp_t1	timestamp	NO		CURRENT_TIMESTAMP	
table_timestamp_t2	datetime	YES		NULL	
table_timestamp_t3	timestamp	NO		0000-00-00 00:00:00	
drop table table_timestamp_t1;
create table table_timestamp_t1 (table_timestamp_t1 timestamp not null default '2003-01-01 00:00:00' on update now(), table_timestamp_t2 datetime);
SET TIMESTAMP=1000000004;
insert into table_timestamp_t1 values ();
select * from table_timestamp_t1 order by table_timestamp_t1;
table_timestamp_t1	table_timestamp_t2
2003-01-01 00:00:00	NULL
SET TIMESTAMP=1000000005;
update table_timestamp_t1 set table_timestamp_t2=now();
SET TIMESTAMP=1000000005;
insert into table_timestamp_t1 (table_timestamp_t1) values (default);
select * from table_timestamp_t1 order by table_timestamp_t1;
table_timestamp_t1	table_timestamp_t2
2001-09-09 04:46:45	2001-09-09 04:46:45
2003-01-01 00:00:00	NULL
show create table table_timestamp_t1;
Table	Create Table
table_timestamp_t1	CREATE TABLE `table_timestamp_t1` (
  `table_timestamp_t1` timestamp NOT NULL DEFAULT '2003-01-01 00:00:00' ON UPDATE CURRENT_TIMESTAMP,
  `table_timestamp_t2` datetime DEFAULT NULL
) ENGINE=SEQUOIADB DEFAULT CHARSET=latin1
show columns from table_timestamp_t1;
Field	Type	Null	Key	Default	Extra
table_timestamp_t1	timestamp	NO		2003-01-01 00:00:00	on update CURRENT_TIMESTAMP
table_timestamp_t2	datetime	YES		NULL	
drop table table_timestamp_t1;
create table table_timestamp_t1 (table_timestamp_t1 timestamp not null default now() on update now(), table_timestamp_t2 datetime);
SET TIMESTAMP=1000000006;
insert into table_timestamp_t1 values ();
select * from table_timestamp_t1 order by table_timestamp_t1;
table_timestamp_t1	table_timestamp_t2
2001-09-09 04:46:46	NULL
SET TIMESTAMP=1000000007;
update table_timestamp_t1 set table_timestamp_t2=now();
SET TIMESTAMP=1000000007;
insert into table_timestamp_t1 (table_timestamp_t1) values (default);
select * from table_timestamp_t1 order by table_timestamp_t1;
table_timestamp_t1	table_timestamp_t2
2001-09-09 04:46:47	2001-09-09 04:46:47
2001-09-09 04:46:47	NULL
show create table table_timestamp_t1;
Table	Create Table
table_timestamp_t1	CREATE TABLE `table_timestamp_t1` (
  `table_timestamp_t1` timestamp NOT NULL DEFAULT CURRENT_TIMESTAMP ON UPDATE CURRENT_TIMESTAMP,
  `table_timestamp_t2` datetime DEFAULT NULL
) ENGINE=SEQUOIADB DEFAULT CHARSET=latin1
show columns from table_timestamp_t1;
Field	Type	Null	Key	Default	Extra
table_timestamp_t1	timestamp	NO		CURRENT_TIMESTAMP	on update CURRENT_TIMESTAMP
table_timestamp_t2	datetime	YES		NULL	
drop table table_timestamp_t1;
create table table_timestamp_t1 (table_timestamp_t1 timestamp NOT NULL DEFAULT CURRENT_TIMESTAMP ON UPDATE CURRENT_TIMESTAMP, table_timestamp_t2 datetime, table_timestamp_t3 timestamp NOT NULL DEFAULT '0000-00-00 00:00:00');
SET TIMESTAMP=1000000007;
insert into table_timestamp_t1 values ();
select * from table_timestamp_t1 order by table_timestamp_t1;
table_timestamp_t1	table_timestamp_t2	table_timestamp_t3
2001-09-09 04:46:47	NULL	0000-00-00 00:00:00
SET TIMESTAMP=1000000008;
update table_timestamp_t1 set table_timestamp_t2=now();
SET TIMESTAMP=1000000008;
insert into table_timestamp_t1 (table_timestamp_t1,table_timestamp_t3) values (default, default);
select * from table_timestamp_t1 order by table_timestamp_t1;
table_timestamp_t1	table_timestamp_t2	table_timestamp_t3
2001-09-09 04:46:48	2001-09-09 04:46:48	0000-00-00 00:00:00
2001-09-09 04:46:48	NULL	0000-00-00 00:00:00
show create table table_timestamp_t1;
Table	Create Table
table_timestamp_t1	CREATE TABLE `table_timestamp_t1` (
  `table_timestamp_t1` timestamp NOT NULL DEFAULT CURRENT_TIMESTAMP ON UPDATE CURRENT_TIMESTAMP,
  `table_timestamp_t2` datetime DEFAULT NULL,
  `table_timestamp_t3` timestamp NOT NULL DEFAULT '0000-00-00 00:00:00'
) ENGINE=SEQUOIADB DEFAULT CHARSET=latin1
show columns from table_timestamp_t1;
Field	Type	Null	Key	Default	Extra
table_timestamp_t1	timestamp	NO		CURRENT_TIMESTAMP	on update CURRENT_TIMESTAMP
table_timestamp_t2	datetime	YES		NULL	
table_timestamp_t3	timestamp	NO		0000-00-00 00:00:00	
drop table table_timestamp_t1;
create table table_timestamp_t1 (table_timestamp_t1 timestamp not null default current_timestamp on update current_timestamp, table_timestamp_t2 datetime);
SET TIMESTAMP=1000000009;
insert into table_timestamp_t1 values ();
select * from table_timestamp_t1 order by table_timestamp_t1;
table_timestamp_t1	table_timestamp_t2
2001-09-09 04:46:49	NULL
SET TIMESTAMP=1000000010;
update table_timestamp_t1 set table_timestamp_t2=now();
SET TIMESTAMP=1000000011;
insert into table_timestamp_t1 (table_timestamp_t1) values (default);
select * from table_timestamp_t1 order by table_timestamp_t1;
table_timestamp_t1	table_timestamp_t2
2001-09-09 04:46:50	2001-09-09 04:46:50
2001-09-09 04:46:51	NULL
show create table table_timestamp_t1;
Table	Create Table
table_timestamp_t1	CREATE TABLE `table_timestamp_t1` (
  `table_timestamp_t1` timestamp NOT NULL DEFAULT CURRENT_TIMESTAMP ON UPDATE CURRENT_TIMESTAMP,
  `table_timestamp_t2` datetime DEFAULT NULL
) ENGINE=SEQUOIADB DEFAULT CHARSET=latin1
show columns from table_timestamp_t1;
Field	Type	Null	Key	Default	Extra
table_timestamp_t1	timestamp	NO		CURRENT_TIMESTAMP	on update CURRENT_TIMESTAMP
table_timestamp_t2	datetime	YES		NULL	
truncate table table_timestamp_t1;
insert into table_timestamp_t1 values ('2004-04-01 00:00:00', '2004-04-01 00:00:00');
SET TIMESTAMP=1000000012;
update table_timestamp_t1 set table_timestamp_t1= '2004-04-02 00:00:00';
select * from table_timestamp_t1 order by table_timestamp_t1;
table_timestamp_t1	table_timestamp_t2
2004-04-02 00:00:00	2004-04-01 00:00:00
update table_timestamp_t1 as ta, table_timestamp_t1 as tb set tb.table_timestamp_t1= '2004-04-03 00:00:00';
select * from table_timestamp_t1 order by table_timestamp_t1;
table_timestamp_t1	table_timestamp_t2
2004-04-03 00:00:00	2004-04-01 00:00:00
drop table table_timestamp_t1;
create table table_timestamp_t1 (pk int primary key, table_timestamp_t1 timestamp not null default current_timestamp on update current_timestamp, bulk int);
insert into table_timestamp_t1 values (1, '2004-04-01 00:00:00', 10);
SET TIMESTAMP=1000000013;
select * from table_timestamp_t1 order by pk;
pk	table_timestamp_t1	bulk
1	2004-04-01 00:00:00	10
drop table table_timestamp_t1;
create table table_timestamp_t1 (pk int primary key, table_timestamp_t1 timestamp not null default '2003-01-01 00:00:00' on update current_timestamp, bulk int);
insert into table_timestamp_t1 values (1, '2004-04-01 00:00:00', 10);
SET TIMESTAMP=1000000014;
select * from table_timestamp_t1 order by pk;
pk	table_timestamp_t1	bulk
1	2004-04-01 00:00:00	10
drop table table_timestamp_t1;
create table table_timestamp_t1 (pk int primary key, table_timestamp_t1 timestamp not null default current_timestamp on update current_timestamp, bulk int);
insert into table_timestamp_t1 values (1, '2004-04-01 00:00:00', 10);
SET TIMESTAMP=1000000015;
select * from table_timestamp_t1 order by pk;
pk	table_timestamp_t1	bulk
1	2004-04-01 00:00:00	10
drop table table_timestamp_t1;
create table table_timestamp_t1 (table_timestamp_t1 timestamp not null default current_timestamp on update current_timestamp);
insert into table_timestamp_t1 values ('2004-04-01 00:00:00');
SET TIMESTAMP=1000000016;
select * from table_timestamp_t1 order by table_timestamp_t1;
table_timestamp_t1
2004-04-01 00:00:00
drop table table_timestamp_t1;
create table table_timestamp_t1 (a timestamp null, b timestamp null);
show create table table_timestamp_t1;
Table	Create Table
table_timestamp_t1	CREATE TABLE `table_timestamp_t1` (
  `a` timestamp NULL DEFAULT NULL,
  `b` timestamp NULL DEFAULT NULL
) ENGINE=SEQUOIADB DEFAULT CHARSET=latin1
insert into table_timestamp_t1 values (NULL, NULL);
SET TIMESTAMP=1000000017;
insert into table_timestamp_t1 values ();
select * from table_timestamp_t1 order by a;
a	b
NULL	NULL
NULL	NULL
drop table table_timestamp_t1;
create table table_timestamp_t1 (a timestamp null default current_timestamp on update current_timestamp, b timestamp null);
show create table table_timestamp_t1;
Table	Create Table
table_timestamp_t1	CREATE TABLE `table_timestamp_t1` (
  `a` timestamp NULL DEFAULT CURRENT_TIMESTAMP ON UPDATE CURRENT_TIMESTAMP,
  `b` timestamp NULL DEFAULT NULL
) ENGINE=SEQUOIADB DEFAULT CHARSET=latin1
insert into table_timestamp_t1 values (NULL, NULL);
SET TIMESTAMP=1000000018;
insert into table_timestamp_t1 values ();
select * from table_timestamp_t1 order by a;
a	b
NULL	NULL
2001-09-09 04:46:58	NULL
drop table table_timestamp_t1;
create table table_timestamp_t1 (a timestamp null default null, b timestamp null default '2003-01-01 00:00:00');
show create table table_timestamp_t1;
Table	Create Table
table_timestamp_t1	CREATE TABLE `table_timestamp_t1` (
  `a` timestamp NULL DEFAULT NULL,
  `b` timestamp NULL DEFAULT '2003-01-01 00:00:00'
) ENGINE=SEQUOIADB DEFAULT CHARSET=latin1
insert into table_timestamp_t1 values (NULL, NULL);
insert into table_timestamp_t1 values (DEFAULT, DEFAULT);
select * from table_timestamp_t1 order by a;
a	b
NULL	NULL
NULL	2003-01-01 00:00:00
drop table table_timestamp_t1;
create table table_timestamp_t1 (a char(2), t timestamp NOT NULL DEFAULT CURRENT_TIMESTAMP ON UPDATE CURRENT_TIMESTAMP);
insert into table_timestamp_t1 values ('a', '2004-01-01 00:00:00'), ('a', '2004-01-01 01:00:00'),
('b', '2004-02-01 00:00:00');
select max(t) from table_timestamp_t1 group by a;
max(t)
2004-01-01 01:00:00
2004-02-01 00:00:00
drop table table_timestamp_t1;
set sql_mode='maxdb';
Warnings:
Warning	3090	Changing sql mode 'NO_AUTO_CREATE_USER' is deprecated. It will be removed in a future release.
create table table_timestamp_t1 (a timestamp, b timestamp);
show create table table_timestamp_t1;
Table	Create Table
table_timestamp_t1	CREATE TABLE "table_timestamp_t1" (
  "a" datetime DEFAULT NULL,
  "b" datetime DEFAULT NULL
)
set sql_mode='';
Warnings:
Warning	3090	Changing sql mode 'NO_AUTO_CREATE_USER' is deprecated. It will be removed in a future release.
drop table table_timestamp_t1;
create table table_timestamp_t1 (a int primary key, b int, c timestamp NOT NULL DEFAULT CURRENT_TIMESTAMP ON UPDATE CURRENT_TIMESTAMP);
insert into table_timestamp_t1 (a, b, c) values (1, 0, '2001-01-01 01:01:01'),
(2, 0, '2002-02-02 02:02:02'), (3, 0, '2003-03-03 03:03:03');
select * from table_timestamp_t1 order by a;
a	b	c
1	0	2001-01-01 01:01:01
2	0	2002-02-02 02:02:02
3	0	2003-03-03 03:03:03
update table_timestamp_t1 set b = 2, c = c where a = 2;
select * from table_timestamp_t1 order by a;
a	b	c
1	0	2001-01-01 01:01:01
2	2	2002-02-02 02:02:02
3	0	2003-03-03 03:03:03
insert into table_timestamp_t1 (a) values (4);
select * from table_timestamp_t1 order by a;
a	b	c
1	0	2001-01-01 01:01:01
2	2	2002-02-02 02:02:02
3	0	2003-03-03 03:03:03
4	NULL	2001-09-09 04:46:58
update table_timestamp_t1 set c = '2004-04-04 04:04:04' where a = 4;
select * from table_timestamp_t1 order by a;
a	b	c
1	0	2001-01-01 01:01:01
2	2	2002-02-02 02:02:02
3	0	2003-03-03 03:03:03
4	NULL	2004-04-04 04:04:04
drop table table_timestamp_t1;
End of 4.1 tests
set time_zone= @@global.time_zone;
CREATE TABLE table_timestamp_t1 (
`id` int(11) NOT NULL ,
`username` varchar(80) NOT NULL default '',
`posted_on` timestamp NOT NULL default '0000-00-00 00:00:00',
PRIMARY KEY (`id`)
) ENGINE=SequoiaDB DEFAULT CHARSET=latin1;
show fields from table_timestamp_t1;
Field	Type	Null	Key	Default	Extra
id	int(11)	NO	PRI	NULL	
username	varchar(80)	NO			
posted_on	timestamp	NO		0000-00-00 00:00:00	
select is_nullable from INFORMATION_SCHEMA.COLUMNS where TABLE_NAME='table_timestamp_t1' and COLUMN_NAME='posted_on';
is_nullable
NO
drop table table_timestamp_t1;
CREATE TABLE table_timestamp_t1 ( f1 INT(11) NOT NULL PRIMARY KEY,
f2 TIMESTAMP NOT NULL DEFAULT CURRENT_TIMESTAMP ON UPDATE CURRENT_TIMESTAMP,
f3 TIMESTAMP NOT NULL default '0000-00-00 00:00:00');
INSERT INTO table_timestamp_t1 (f2,f3) VALUES (NOW(), "0000-00-00 00:00:00");
Warnings:
Warning	1364	Field 'f1' doesn't have a default value
UPDATE table_timestamp_t1 SET f2=NOW(), f3=FROM_UNIXTIME('9999999999') WHERE f1=1;
SELECT f1,f2-f3 FROM table_timestamp_t1 order by f1;
f1	f2-f3
0	20010909044658
DROP TABLE table_timestamp_t1;
End of 5.0 tests
#
# Bug #55779: select does not work properly in mysql server
#             Version "5.1.42 SUSE MySQL RPM"
#
CREATE TABLE table_timestamp_t1 (a TIMESTAMP NOT NULL DEFAULT CURRENT_TIMESTAMP ON UPDATE CURRENT_TIMESTAMP);
INSERT INTO table_timestamp_t1 VALUES ('2000-01-01 00:00:00'), ('2000-01-01 00:00:00'),
('2000-01-01 00:00:01'), ('2000-01-01 00:00:01');
SELECT a FROM table_timestamp_t1 WHERE a >=  20000101000000 order by a;
a
2000-01-01 00:00:00
2000-01-01 00:00:00
2000-01-01 00:00:01
2000-01-01 00:00:01
SELECT a FROM table_timestamp_t1 WHERE a >= '20000101000000' order by a;
a
2000-01-01 00:00:00
2000-01-01 00:00:00
2000-01-01 00:00:01
2000-01-01 00:00:01
DROP TABLE table_timestamp_t1;
#
# Bug#50774: failed to get the correct resultset when timestamp values 
# are appended with .0
#
CREATE TABLE table_timestamp_t1 ( a TIMESTAMP);
INSERT INTO table_timestamp_t1 VALUES( '2010-02-01 09:31:01' );
INSERT INTO table_timestamp_t1 VALUES( '2010-02-01 09:31:02' );
INSERT INTO table_timestamp_t1 VALUES( '2010-02-01 09:31:03' );
INSERT INTO table_timestamp_t1 VALUES( '2010-02-01 09:31:04' );
SELECT * FROM table_timestamp_t1 WHERE a >= '2010-02-01 09:31:02.0' order by a;
a
2010-02-01 09:31:02
2010-02-01 09:31:03
2010-02-01 09:31:04
SELECT * FROM table_timestamp_t1 WHERE '2010-02-01 09:31:02.0' <= a order by a;
a
2010-02-01 09:31:02
2010-02-01 09:31:03
2010-02-01 09:31:04
SELECT * FROM table_timestamp_t1 WHERE a <= '2010-02-01 09:31:02.0' order by a;
a
2010-02-01 09:31:01
2010-02-01 09:31:02
SELECT * FROM table_timestamp_t1 WHERE '2010-02-01 09:31:02.0' >= a order by a;
a
2010-02-01 09:31:01
2010-02-01 09:31:02
EXPLAIN
SELECT * FROM table_timestamp_t1 WHERE a >= '2010-02-01 09:31:02.0' order by a;
id	select_type	table	partitions	type	possible_keys	key	key_len	ref	rows	filtered	Extra
x	x	x	NULL	ALL	x	x	x	x	x	0.00	x
Warnings:
x	x	x
SELECT * FROM table_timestamp_t1 WHERE a >= '2010-02-01 09:31:02.0' order by a;
a
2010-02-01 09:31:02
2010-02-01 09:31:03
2010-02-01 09:31:04
CREATE TABLE table_timestamp_t2 ( a TIMESTAMP);
INSERT INTO table_timestamp_t2 VALUES( '2010-02-01 09:31:01' );
INSERT INTO table_timestamp_t2 VALUES( '2010-02-01 09:31:02' );
INSERT INTO table_timestamp_t2 VALUES( '2010-02-01 09:31:03' );
INSERT INTO table_timestamp_t2 VALUES( '2010-02-01 09:31:04' );
INSERT INTO table_timestamp_t2 VALUES( '2010-02-01 09:31:05' );
INSERT INTO table_timestamp_t2 VALUES( '2010-02-01 09:31:06' );
INSERT INTO table_timestamp_t2 VALUES( '2010-02-01 09:31:07' );
INSERT INTO table_timestamp_t2 VALUES( '2010-02-01 09:31:08' );
INSERT INTO table_timestamp_t2 VALUES( '2010-02-01 09:31:09' );
INSERT INTO table_timestamp_t2 VALUES( '2010-02-01 09:31:10' );
INSERT INTO table_timestamp_t2 VALUES( '2010-02-01 09:31:11' );
# The bug would cause the range optimizer's comparison to use an open
# interval here. This reveals itself only in the number of reads 
# performed.
FLUSH STATUS;
EXPLAIN
SELECT * FROM table_timestamp_t2 WHERE a < '2010-02-01 09:31:02.0' order by a;
id	select_type	table	partitions	type	possible_keys	key	key_len	ref	rows	filtered	Extra
x	x	x	NULL	ALL	x	x	x	x	x	33.33	x
Warnings:
x	x	x
SELECT * FROM table_timestamp_t2 WHERE a < '2010-02-01 09:31:02.0' order by a;
a
2010-02-01 09:31:01
SHOW STATUS LIKE 'Handler_read_next';
Variable_name	Value
Handler_read_next	0
DROP TABLE table_timestamp_t1, table_timestamp_t2;
End of 5.1 tests

Bug#50888 valgrind warnings in Field_timestamp::val_str

SET TIMESTAMP=0;
CREATE TABLE table_timestamp_t1(a timestamp NOT NULL DEFAULT CURRENT_TIMESTAMP ON UPDATE CURRENT_TIMESTAMP);
INSERT INTO table_timestamp_t1 VALUES ('2008-02-23 09:23:45'), ('2010-03-05 11:08:02');
FLUSH TABLES table_timestamp_t1;
SELECT MAX(a) FROM table_timestamp_t1 order by a;
MAX(a)
2010-03-05 11:08:02
SELECT a FROM table_timestamp_t1 order by a;
a
2008-02-23 09:23:45
2010-03-05 11:08:02
DROP TABLE table_timestamp_t1;
End of Bug#50888
#
# Bug59330: Incorrect result when comparing an aggregate
#           function with TIMESTAMP
#
CREATE TABLE table_timestamp_t1 (dt DATETIME, ts TIMESTAMP);
INSERT INTO table_timestamp_t1 VALUES('2011-01-06 12:34:30', '2011-01-06 12:34:30');
SELECT MAX(dt), MAX(ts) FROM table_timestamp_t1;
MAX(dt)	MAX(ts)
2011-01-06 12:34:30	2011-01-06 12:34:30
SELECT MAX(ts) < '2010-01-01 00:00:00' FROM table_timestamp_t1;
MAX(ts) < '2010-01-01 00:00:00'
0
SELECT MAX(dt) < '2010-01-01 00:00:00' FROM table_timestamp_t1;
MAX(dt) < '2010-01-01 00:00:00'
0
SELECT MAX(ts) > '2010-01-01 00:00:00' FROM table_timestamp_t1;
MAX(ts) > '2010-01-01 00:00:00'
1
SELECT MAX(dt) > '2010-01-01 00:00:00' FROM table_timestamp_t1;
MAX(dt) > '2010-01-01 00:00:00'
1
SELECT MAX(ts) = '2011-01-06 12:34:30' FROM table_timestamp_t1;
MAX(ts) = '2011-01-06 12:34:30'
1
SELECT MAX(dt) = '2011-01-06 12:34:30' FROM table_timestamp_t1;
MAX(dt) = '2011-01-06 12:34:30'
1
DROP TABLE table_timestamp_t1;
DROP TABLE IF EXISTS table_timestamp_t1, table_timestamp_t2, table_timestamp_t3;
SET @org_mode=@@sql_mode;
#Table creation in strict mode
SET @@sql_mode='NO_ZERO_DATE,STRICT_ALL_TABLES';
Warnings:
Warning	3135	'NO_ZERO_DATE', 'NO_ZERO_IN_DATE' and 'ERROR_FOR_DIVISION_BY_ZERO' sql modes should be used with strict mode. They will be merged with strict mode in a future release.
CREATE TABLE table_timestamp_t1 (c1 TIMESTAMP DEFAULT 0);
ERROR 42000: Invalid default value for 'c1'
CREATE TABLE table_timestamp_t1 (c1 TIMESTAMP DEFAULT '0000-00-00 00:00:00');
ERROR 42000: Invalid default value for 'c1'
CREATE TABLE table_timestamp_t1 (c1 TIMESTAMP DEFAULT '2012-02-00 12:12:12');
ERROR 42000: Invalid default value for 'c1'
#Table creation in non-strict mode but with NO_ZERO_DATE/NO_ZERO_IN_DATE
SET @@sql_mode='NO_ZERO_DATE';
Warnings:
Warning	3135	'NO_ZERO_DATE', 'NO_ZERO_IN_DATE' and 'ERROR_FOR_DIVISION_BY_ZERO' sql modes should be used with strict mode. They will be merged with strict mode in a future release.
CREATE TABLE table_timestamp_t1 (c1 TIMESTAMP DEFAULT 0);
Warnings:
Warning	1264	Out of range value for column 'c1' at row 1
CREATE TABLE table_timestamp_t2 (c1 TIMESTAMP DEFAULT '0000-00-00 00:00:00');
Warnings:
Warning	1264	Out of range value for column 'c1' at row 1
SET @@sql_mode='NO_ZERO_IN_DATE';
Warnings:
Warning	3135	'NO_ZERO_DATE', 'NO_ZERO_IN_DATE' and 'ERROR_FOR_DIVISION_BY_ZERO' sql modes should be used with strict mode. They will be merged with strict mode in a future release.
CREATE TABLE table_timestamp_t3 (c1 TIMESTAMP DEFAULT '2012-02-00 12:12:12');
Warnings:
Warning	1264	Out of range value for column 'c1' at row 1
DROP TABLE table_timestamp_t1, table_timestamp_t2, table_timestamp_t3;
#Table creation with out any SQL modes
SET @@sql_mode='';
CREATE TABLE table_timestamp_t1 (c1 TIMESTAMP DEFAULT 0);
CREATE TABLE table_timestamp_t2 (c1 TIMESTAMP DEFAULT '0000-00-00 00:00:00');
CREATE TABLE table_timestamp_t3 (c1 TIMESTAMP DEFAULT '2012-02-00 12:12:12');
Warnings:
Warning	1264	Out of range value for column 'c1' at row 1
DROP TABLE table_timestamp_t1, table_timestamp_t2, table_timestamp_t3;
SET @@sql_mode= default;
create table table_timestamp_t1 (a timestamp);
insert into table_timestamp_t1 values ('1970-01-01 10:00:00');
insert into table_timestamp_t1 values ('2000-01-01 00:00:01');
insert into table_timestamp_t1 values ('2038-01-01 11:00:00');
insert into table_timestamp_t1 values ('abcd');
ERROR 22007: Incorrect datetime value: 'abcd' for column 'a' at row 1
insert into table_timestamp_t1 values ('2039-01-11 01:00:00');
ERROR 22007: Incorrect datetime value: '2039-01-11 01:00:00' for column 'a' at row 1
insert into table_timestamp_t1 values ('1940-01-11 01:00:00');
ERROR 22007: Incorrect datetime value: '1940-01-11 01:00:00' for column 'a' at row 1
select * from table_timestamp_t1 order by a;
a
1970-01-01 10:00:00
2000-01-01 00:00:01
2038-01-01 11:00:00
update table_timestamp_t1 set a = '2018-01-01 00:00:01' where a = '2000-01-01 00:00:01';
select * from table_timestamp_t1 order by a;
a
1970-01-01 10:00:00
2018-01-01 00:00:01
2038-01-01 11:00:00
delete from table_timestamp_t1 where a = '2000-01-01 00:00:01';
select * from table_timestamp_t1 order by a;
a
1970-01-01 10:00:00
2018-01-01 00:00:01
2038-01-01 11:00:00
drop table table_timestamp_t1;
