drop table if exists table_in_t1, table_in_t2;
CREATE TABLE table_in_t1 (a int, b int, c int);
insert into table_in_t1 values (1,2,3), (1,NULL,3);
select 1 in (a,b,c) from table_in_t1 order by a;
1 in (a,b,c)
1
1
select 3 in (a,b,c) from table_in_t1 order by a;
3 in (a,b,c)
1
1
select 10 in (a,b,c) from table_in_t1 order by a;
10 in (a,b,c)
0
NULL
select NULL in (a,b,c) from table_in_t1 order by a;
NULL in (a,b,c)
NULL
NULL
drop table table_in_t1;
CREATE TABLE table_in_t1 (a float, b float, c float);
insert into table_in_t1 values (1.5,2.5,3.5), (1.5,NULL,3.5);
select 1.5 in (a,b,c) from table_in_t1 order by a;
1.5 in (a,b,c)
1
1
select 3.5 in (a,b,c) from table_in_t1 order by a;
3.5 in (a,b,c)
1
1
select 10.5 in (a,b,c) from table_in_t1 order by a;
10.5 in (a,b,c)
0
NULL
drop table table_in_t1;
CREATE TABLE table_in_t1 (a varchar(10), b varchar(10), c varchar(10));
insert into table_in_t1 values ('A','BC','EFD'), ('A',NULL,'EFD');
select 'A' in (a,b,c) from table_in_t1 order by a;
'A' in (a,b,c)
1
1
select 'EFD' in (a,b,c) from table_in_t1 order by a;
'EFD' in (a,b,c)
1
1
select 'XSFGGHF' in (a,b,c) from table_in_t1 order by a;
'XSFGGHF' in (a,b,c)
0
NULL
drop table table_in_t1;
CREATE TABLE table_in_t1 (field char(1));
INSERT INTO table_in_t1 VALUES ('A'),(NULL);
SELECT * from table_in_t1 WHERE field IN (NULL);
field
SELECT * from table_in_t1 WHERE field NOT IN (NULL);
field
DELETE FROM table_in_t1 WHERE field NOT IN (NULL);
SELECT * FROM table_in_t1;
field
A
NULL
drop table table_in_t1;
create table table_in_t1 (id int(10) primary key);
insert into table_in_t1 values (1),(2),(3),(4),(5),(6),(7),(8),(9);
select * from table_in_t1 where id in (2,5,9) order by id;
id
2
5
9
drop table table_in_t1;
create table table_in_t1 (
a char(1) character set latin1 collate latin1_general_ci,
b char(1) character set latin1 collate latin1_swedish_ci,
c char(1) character set latin1 collate latin1_danish_ci
);
insert into table_in_t1 values ('A','B','C');
insert into table_in_t1 values ('a','c','c');
select * from table_in_t1 where a in (b);
ERROR HY000: Illegal mix of collations (latin1_general_ci,IMPLICIT) and (latin1_swedish_ci,IMPLICIT) for operation '='
select * from table_in_t1 where a in (b,c);
ERROR HY000: Illegal mix of collations (latin1_general_ci,IMPLICIT), (latin1_swedish_ci,IMPLICIT), (latin1_danish_ci,IMPLICIT) for operation ' IN '
select * from table_in_t1 where 'a' in (a,b,c) order by a;
ERROR HY000: Illegal mix of collations for operation ' IN '
select * from table_in_t1 where 'a' in (a) order by a;
a	b	c
a	c	c
select * from table_in_t1 where a in ('a') order by a;
a	b	c
a	c	c
select * from table_in_t1 where 'a' collate latin1_general_ci in (a,b,c) order by a;
a	b	c
A	B	C
a	c	c
select * from table_in_t1 where 'a' collate latin1_bin in (a,b,c) order by a;
a	b	c
a	c	c
select * from table_in_t1 where 'a' in (a,b,c collate latin1_bin) order by a;
a	b	c
a	c	c
drop table table_in_t1;
set names utf8;
create table table_in_t1 (a char(10) character set utf8 not null);
insert into table_in_t1 values ('bbbb'),(_koi8r'√√√√'),(_latin1'ƒƒƒƒ');
select a from table_in_t1 where a in ('bbbb',_koi8r'√√√√',_latin1'ƒƒƒƒ') order by a;
a
√Ñ√Ñ√Ñ√Ñ
bbbb
—Ü—Ü—Ü—Ü
drop table table_in_t1;
create table table_in_t1 (a char(10) character set latin1 not null);
insert into table_in_t1 values ('a'),('b'),('c');
select a from table_in_t1 where a IN ('a','b','c') order by a;
a
a
b
c
drop table table_in_t1;
set names latin1;
DROP TABLE IF EXISTS table_in_t1;
CREATE TABLE table_in_t1 (a int PRIMARY KEY);
INSERT INTO table_in_t1 VALUES (44), (45), (46);
SELECT * FROM table_in_t1 WHERE a IN (45);
a
45
SELECT * FROM table_in_t1 WHERE a NOT IN (0, 45);
a
44
46
SELECT * FROM table_in_t1 WHERE a NOT IN (45);
a
44
46
CREATE VIEW v1 AS SELECT * FROM table_in_t1 WHERE a NOT IN (45);
SHOW CREATE VIEW v1;
View	Create View	character_set_client	collation_connection
v1	CREATE ALGORITHM=UNDEFINED DEFINER=`root`@`localhost` SQL SECURITY DEFINER VIEW `v1` AS select `table_in_t1`.`a` AS `a` from `table_in_t1` where (`table_in_t1`.`a` <> 45)	latin1	latin1_swedish_ci
SELECT * FROM v1;
a
44
46
DROP VIEW v1;
DROP TABLE table_in_t1;
create table table_in_t1 (a int);
insert into table_in_t1 values (0),(1),(2),(3),(4),(5),(6),(7),(8),(9);
create table table_in_t2 (a int, filler char(200), key(a));
insert into table_in_t2 select C.a*2,   'no'  from table_in_t1 A, table_in_t1 B, table_in_t1 C;
insert into table_in_t2 select C.a*2+1, 'yes' from table_in_t1 C;
select * from table_in_t2 where a NOT IN (0, 2,4,6,8,10,12,14,16,18) order by a;
a	filler
1	yes
3	yes
5	yes
7	yes
9	yes
11	yes
13	yes
15	yes
17	yes
19	yes
select * from table_in_t2 where a NOT IN (0, 2,4,6,8,10,12,14,16,18) order by a;
a	filler
1	yes
3	yes
5	yes
7	yes
9	yes
11	yes
13	yes
15	yes
17	yes
19	yes
select * from table_in_t2 force index(a) where a NOT IN (2,2,2,2,2,2) order by a;
a	filler
0	no
0	no
0	no
0	no
0	no
0	no
0	no
0	no
0	no
0	no
0	no
0	no
0	no
0	no
0	no
0	no
0	no
0	no
0	no
0	no
0	no
0	no
0	no
0	no
0	no
0	no
0	no
0	no
0	no
0	no
0	no
0	no
0	no
0	no
0	no
0	no
0	no
0	no
0	no
0	no
0	no
0	no
0	no
0	no
0	no
0	no
0	no
0	no
0	no
0	no
0	no
0	no
0	no
0	no
0	no
0	no
0	no
0	no
0	no
0	no
0	no
0	no
0	no
0	no
0	no
0	no
0	no
0	no
0	no
0	no
0	no
0	no
0	no
0	no
0	no
0	no
0	no
0	no
0	no
0	no
0	no
0	no
0	no
0	no
0	no
0	no
0	no
0	no
0	no
0	no
0	no
0	no
0	no
0	no
0	no
0	no
0	no
0	no
0	no
0	no
1	yes
3	yes
4	no
4	no
4	no
4	no
4	no
4	no
4	no
4	no
4	no
4	no
4	no
4	no
4	no
4	no
4	no
4	no
4	no
4	no
4	no
4	no
4	no
4	no
4	no
4	no
4	no
4	no
4	no
4	no
4	no
4	no
4	no
4	no
4	no
4	no
4	no
4	no
4	no
4	no
4	no
4	no
4	no
4	no
4	no
4	no
4	no
4	no
4	no
4	no
4	no
4	no
4	no
4	no
4	no
4	no
4	no
4	no
4	no
4	no
4	no
4	no
4	no
4	no
4	no
4	no
4	no
4	no
4	no
4	no
4	no
4	no
4	no
4	no
4	no
4	no
4	no
4	no
4	no
4	no
4	no
4	no
4	no
4	no
4	no
4	no
4	no
4	no
4	no
4	no
4	no
4	no
4	no
4	no
4	no
4	no
4	no
4	no
4	no
4	no
4	no
4	no
5	yes
6	no
6	no
6	no
6	no
6	no
6	no
6	no
6	no
6	no
6	no
6	no
6	no
6	no
6	no
6	no
6	no
6	no
6	no
6	no
6	no
6	no
6	no
6	no
6	no
6	no
6	no
6	no
6	no
6	no
6	no
6	no
6	no
6	no
6	no
6	no
6	no
6	no
6	no
6	no
6	no
6	no
6	no
6	no
6	no
6	no
6	no
6	no
6	no
6	no
6	no
6	no
6	no
6	no
6	no
6	no
6	no
6	no
6	no
6	no
6	no
6	no
6	no
6	no
6	no
6	no
6	no
6	no
6	no
6	no
6	no
6	no
6	no
6	no
6	no
6	no
6	no
6	no
6	no
6	no
6	no
6	no
6	no
6	no
6	no
6	no
6	no
6	no
6	no
6	no
6	no
6	no
6	no
6	no
6	no
6	no
6	no
6	no
6	no
6	no
6	no
7	yes
8	no
8	no
8	no
8	no
8	no
8	no
8	no
8	no
8	no
8	no
8	no
8	no
8	no
8	no
8	no
8	no
8	no
8	no
8	no
8	no
8	no
8	no
8	no
8	no
8	no
8	no
8	no
8	no
8	no
8	no
8	no
8	no
8	no
8	no
8	no
8	no
8	no
8	no
8	no
8	no
8	no
8	no
8	no
8	no
8	no
8	no
8	no
8	no
8	no
8	no
8	no
8	no
8	no
8	no
8	no
8	no
8	no
8	no
8	no
8	no
8	no
8	no
8	no
8	no
8	no
8	no
8	no
8	no
8	no
8	no
8	no
8	no
8	no
8	no
8	no
8	no
8	no
8	no
8	no
8	no
8	no
8	no
8	no
8	no
8	no
8	no
8	no
8	no
8	no
8	no
8	no
8	no
8	no
8	no
8	no
8	no
8	no
8	no
8	no
8	no
9	yes
10	no
10	no
10	no
10	no
10	no
10	no
10	no
10	no
10	no
10	no
10	no
10	no
10	no
10	no
10	no
10	no
10	no
10	no
10	no
10	no
10	no
10	no
10	no
10	no
10	no
10	no
10	no
10	no
10	no
10	no
10	no
10	no
10	no
10	no
10	no
10	no
10	no
10	no
10	no
10	no
10	no
10	no
10	no
10	no
10	no
10	no
10	no
10	no
10	no
10	no
10	no
10	no
10	no
10	no
10	no
10	no
10	no
10	no
10	no
10	no
10	no
10	no
10	no
10	no
10	no
10	no
10	no
10	no
10	no
10	no
10	no
10	no
10	no
10	no
10	no
10	no
10	no
10	no
10	no
10	no
10	no
10	no
10	no
10	no
10	no
10	no
10	no
10	no
10	no
10	no
10	no
10	no
10	no
10	no
10	no
10	no
10	no
10	no
10	no
10	no
11	yes
12	no
12	no
12	no
12	no
12	no
12	no
12	no
12	no
12	no
12	no
12	no
12	no
12	no
12	no
12	no
12	no
12	no
12	no
12	no
12	no
12	no
12	no
12	no
12	no
12	no
12	no
12	no
12	no
12	no
12	no
12	no
12	no
12	no
12	no
12	no
12	no
12	no
12	no
12	no
12	no
12	no
12	no
12	no
12	no
12	no
12	no
12	no
12	no
12	no
12	no
12	no
12	no
12	no
12	no
12	no
12	no
12	no
12	no
12	no
12	no
12	no
12	no
12	no
12	no
12	no
12	no
12	no
12	no
12	no
12	no
12	no
12	no
12	no
12	no
12	no
12	no
12	no
12	no
12	no
12	no
12	no
12	no
12	no
12	no
12	no
12	no
12	no
12	no
12	no
12	no
12	no
12	no
12	no
12	no
12	no
12	no
12	no
12	no
12	no
12	no
13	yes
14	no
14	no
14	no
14	no
14	no
14	no
14	no
14	no
14	no
14	no
14	no
14	no
14	no
14	no
14	no
14	no
14	no
14	no
14	no
14	no
14	no
14	no
14	no
14	no
14	no
14	no
14	no
14	no
14	no
14	no
14	no
14	no
14	no
14	no
14	no
14	no
14	no
14	no
14	no
14	no
14	no
14	no
14	no
14	no
14	no
14	no
14	no
14	no
14	no
14	no
14	no
14	no
14	no
14	no
14	no
14	no
14	no
14	no
14	no
14	no
14	no
14	no
14	no
14	no
14	no
14	no
14	no
14	no
14	no
14	no
14	no
14	no
14	no
14	no
14	no
14	no
14	no
14	no
14	no
14	no
14	no
14	no
14	no
14	no
14	no
14	no
14	no
14	no
14	no
14	no
14	no
14	no
14	no
14	no
14	no
14	no
14	no
14	no
14	no
14	no
15	yes
16	no
16	no
16	no
16	no
16	no
16	no
16	no
16	no
16	no
16	no
16	no
16	no
16	no
16	no
16	no
16	no
16	no
16	no
16	no
16	no
16	no
16	no
16	no
16	no
16	no
16	no
16	no
16	no
16	no
16	no
16	no
16	no
16	no
16	no
16	no
16	no
16	no
16	no
16	no
16	no
16	no
16	no
16	no
16	no
16	no
16	no
16	no
16	no
16	no
16	no
16	no
16	no
16	no
16	no
16	no
16	no
16	no
16	no
16	no
16	no
16	no
16	no
16	no
16	no
16	no
16	no
16	no
16	no
16	no
16	no
16	no
16	no
16	no
16	no
16	no
16	no
16	no
16	no
16	no
16	no
16	no
16	no
16	no
16	no
16	no
16	no
16	no
16	no
16	no
16	no
16	no
16	no
16	no
16	no
16	no
16	no
16	no
16	no
16	no
16	no
17	yes
18	no
18	no
18	no
18	no
18	no
18	no
18	no
18	no
18	no
18	no
18	no
18	no
18	no
18	no
18	no
18	no
18	no
18	no
18	no
18	no
18	no
18	no
18	no
18	no
18	no
18	no
18	no
18	no
18	no
18	no
18	no
18	no
18	no
18	no
18	no
18	no
18	no
18	no
18	no
18	no
18	no
18	no
18	no
18	no
18	no
18	no
18	no
18	no
18	no
18	no
18	no
18	no
18	no
18	no
18	no
18	no
18	no
18	no
18	no
18	no
18	no
18	no
18	no
18	no
18	no
18	no
18	no
18	no
18	no
18	no
18	no
18	no
18	no
18	no
18	no
18	no
18	no
18	no
18	no
18	no
18	no
18	no
18	no
18	no
18	no
18	no
18	no
18	no
18	no
18	no
18	no
18	no
18	no
18	no
18	no
18	no
18	no
18	no
18	no
18	no
19	yes
drop table table_in_t2;
create table table_in_t2 (a datetime, filler char(200));
insert into table_in_t2 select '2006-04-25 10:00:00' + interval C.a minute,
'no'  from table_in_t1 A, table_in_t1 B, table_in_t1 C where C.a % 2 = 0;
insert into table_in_t2 select '2006-04-25 10:00:00' + interval C.a*2+1 minute,
'yes' from table_in_t1 C;
select * from table_in_t2 where a NOT IN (
'2006-04-25 10:00:00','2006-04-25 10:02:00','2006-04-25 10:04:00', 
'2006-04-25 10:06:00', '2006-04-25 10:08:00') order by a;
a	filler
2006-04-25 10:01:00	yes
2006-04-25 10:03:00	yes
2006-04-25 10:05:00	yes
2006-04-25 10:07:00	yes
2006-04-25 10:09:00	yes
2006-04-25 10:11:00	yes
2006-04-25 10:13:00	yes
2006-04-25 10:15:00	yes
2006-04-25 10:17:00	yes
2006-04-25 10:19:00	yes
drop table table_in_t2;
create table table_in_t2 (a varchar(10), filler char(200), key(a));
insert into table_in_t2 select 'foo', 'no' from table_in_t1 A, table_in_t1 B;
insert into table_in_t2 select 'barbar', 'no' from table_in_t1 A, table_in_t1 B;
insert into table_in_t2 select 'bazbazbaz', 'no' from table_in_t1 A, table_in_t1 B;
insert into table_in_t2 values ('fon', '1'), ('fop','1'), ('barbaq','1'), 
('barbas','1'), ('bazbazbay', '1'),('zz','1');
select * from table_in_t2 where a not in('foo','barbar', 'bazbazbaz') order by a;
a	filler
barbaq	1
barbas	1
bazbazbay	1
fon	1
fop	1
zz	1
drop table table_in_t2;
create table table_in_t2 (a decimal(10,5), filler char(200));
insert into table_in_t2 select 345.67890, 'no' from table_in_t1 A, table_in_t1 B;
insert into table_in_t2 select 43245.34, 'no' from table_in_t1 A, table_in_t1 B;
insert into table_in_t2 select 64224.56344, 'no' from table_in_t1 A, table_in_t1 B;
insert into table_in_t2 values (0, '1'), (22334.123,'1'), (33333,'1'), 
(55555,'1'), (77777, '1');
select * from table_in_t2 where a not in (345.67890, 43245.34, 64224.56344) order by a;
a	filler
0.00000	1
22334.12300	1
33333.00000	1
55555.00000	1
77777.00000	1
select * from table_in_t2 where a not in (345.67890, 43245.34, 64224.56344) order by a;
a	filler
0.00000	1
22334.12300	1
33333.00000	1
55555.00000	1
77777.00000	1
drop table table_in_t1,table_in_t2;
create table table_in_t1 (
some_id smallint(5) unsigned,
key (some_id)
);
insert into table_in_t1 values (1),(2);
select some_id from table_in_t1 where some_id not in(2,-1) order by some_id;
some_id
1
select some_id from table_in_t1 where some_id not in(-4,-1,-4) order by some_id;
some_id
1
2
select some_id from table_in_t1 where some_id not in(-4,-1,3423534,2342342) order by some_id;
some_id
1
2
select some_id from table_in_t1 where some_id not in('-1', '0') order by some_id;
some_id
1
2
drop table table_in_t1;
create table table_in_t1(f1 char(1));
insert into table_in_t1 values ('a'),('b'),('1');
select f1 from table_in_t1 where f1 in ('a',1) order by f1;
f1
1
a
Warnings:
Warning	1292	Truncated incorrect DOUBLE value: 'b'
select f1, case f1 when 'a' then '+' when 1 then '-' end from table_in_t1 order by f1;
f1	case f1 when 'a' then '+' when 1 then '-' end
1	-
a	+
b	NULL
Warnings:
Warning	1292	Truncated incorrect DOUBLE value: 'b'
create index table_in_t1f1_idx on table_in_t1(f1);
select f1 from table_in_t1 where f1 in ('a',1) order by f1;
f1
1
a
Warnings:
Warning	1292	Truncated incorrect DOUBLE value: 'b'
select f1 from table_in_t1 where f1 in ('a','b') order by f1;
f1
a
b
select f1 from table_in_t1 where f1 in (2,1) order by f1;
f1
1
Warnings:
Warning	1292	Truncated incorrect DOUBLE value: 'a'
Warning	1292	Truncated incorrect DOUBLE value: 'b'
drop table table_in_t1;
create table table_in_t1 (a time);
insert into table_in_t1 values (),(),(),(),(),(),(),(),(),();
select a from table_in_t1 where a not in (a,a,a) group by a;
a
drop table table_in_t1;
create table table_in_t1 (id int);
select * from table_in_t1 where NOT id in (select null union all select 1);
id
select * from table_in_t1 where NOT id in (null, 1);
id
drop table table_in_t1;
