drop table if exists table_like_t1;
create table table_like_t1 (a varchar(10), key(a));
insert into table_like_t1 values ("a"),("abc"),("abcd"),("hello"),("test");
select * from table_like_t1 where a like "abc%";
a
abc
abcd
select * from table_like_t1 where a like concat("abc","%") order by a;
a
abc
abcd
select * from table_like_t1 where a like "ABC%" order by a;
a
abc
abcd
select * from table_like_t1 where a like "test%" order by a;
a
test
select * from table_like_t1 where a like "te_t" order by a;
a
test
drop table table_like_t1;
create table table_like_t1 (a varchar(10), key(a));
insert into table_like_t1 values ('a'), ('a\\b');
select * from table_like_t1 where a like 'a\\%' escape '#';
a
a\b
select * from table_like_t1 where a like 'a\\%' escape '#' and a like 'a\\\\b';
a
drop table table_like_t1;
create table table_like_t1 (a datetime);
insert into table_like_t1 values ('2004-03-11 12:00:21');
select * from table_like_t1 where a like '2004-03-11 12:00:21';
a
2004-03-11 12:00:21
drop table table_like_t1;
SET NAMES cp1250;
CREATE TABLE table_like_t1 (a varchar(250) NOT NULL) DEFAULT CHARACTER SET=cp1250;
INSERT INTO table_like_t1 VALUES
('Techni Tapes Sp. z o.o.'),
('Pojazdy Szynowe PESA Bydgoszcz SA Holding'),
('AKAPESTER 1 P.P.H.U.'),
('Pojazdy Szynowe PESA Bydgoszcz S A Holding'),
('PPUH PESKA-I Maria Struniarska');
select * from table_like_t1 where a like '%PESA%' order by a;
a
Pojazdy Szynowe PESA Bydgoszcz S A Holding
Pojazdy Szynowe PESA Bydgoszcz SA Holding
select * from table_like_t1 where a like '%PESA %' order by a;
a
Pojazdy Szynowe PESA Bydgoszcz S A Holding
Pojazdy Szynowe PESA Bydgoszcz SA Holding
select * from table_like_t1 where a like '%PES%' order by a;
a
AKAPESTER 1 P.P.H.U.
Pojazdy Szynowe PESA Bydgoszcz S A Holding
Pojazdy Szynowe PESA Bydgoszcz SA Holding
PPUH PESKA-I Maria Struniarska
Techni Tapes Sp. z o.o.
select * from table_like_t1 where a like '%PESKA%' order by a;
a
PPUH PESKA-I Maria Struniarska
select * from table_like_t1 where a like '%ESKA%' order by a;
a
PPUH PESKA-I Maria Struniarska
DROP TABLE table_like_t1;
#
# Bug #54575: crash when joining tables with unique set column
#
CREATE TABLE table_like_t1(a SET('a') NOT NULL, UNIQUE KEY(a));
CREATE TABLE table_like_t2(b INT PRIMARY KEY);
INSERT IGNORE INTO table_like_t1 VALUES ();
Warnings:
Warning	1364	Field 'a' doesn't have a default value
INSERT INTO table_like_t2 VALUES (1), (2), (3);
SELECT 1 FROM table_like_t2 JOIN table_like_t1 ON 1 LIKE a GROUP BY a order by a;
1
DROP TABLE table_like_t1, table_like_t2;
#
# Bug#19931126 VALGRIND REPORTS USE OF UNINITIALIZED VALUE IN
#              MY_WILDCMP_BIN_IMPL
#
CREATE TABLE table_like_t1(x CHAR(1));
SELECT ('a%b' LIKE 'a\%b' ESCAPE (SELECT x FROM table_like_t1));
('a%b' LIKE 'a\%b' ESCAPE (SELECT x FROM table_like_t1))
1
SELECT ('a%b' LIKE 'ax%b' ESCAPE (SELECT x FROM table_like_t1));
('a%b' LIKE 'ax%b' ESCAPE (SELECT x FROM table_like_t1))
0
INSERT INTO table_like_t1 VALUES ('x');
SELECT ('a%b' LIKE 'a\%b' ESCAPE (SELECT x FROM table_like_t1));
('a%b' LIKE 'a\%b' ESCAPE (SELECT x FROM table_like_t1))
0
SELECT ('a%b' LIKE 'ax%b' ESCAPE (SELECT x FROM table_like_t1));
('a%b' LIKE 'ax%b' ESCAPE (SELECT x FROM table_like_t1))
1
SELECT ('a%b' LIKE 'ax%b' ESCAPE (SELECT 'xy' FROM table_like_t1));
ERROR HY000: Incorrect arguments to ESCAPE
INSERT INTO table_like_t1 VALUES ('y');
SELECT ('a%b' LIKE 'ax%b' ESCAPE (SELECT x FROM table_like_t1));
ERROR 21000: Subquery returns more than 1 row
DELETE FROM table_like_t1 WHERE x = 'y';
SELECT ('a%b' LIKE 'ax%b' ESCAPE (SELECT x, x FROM table_like_t1));
ERROR 21000: Operand should contain 1 column(s)
SELECT ('a%b' LIKE 'ax%b' ESCAPE ('x', 'y'));
ERROR 21000: Operand should contain 1 column(s)
SELECT ('a%b' LIKE 'ax%b' ESCAPE x) FROM table_like_t1;
ERROR HY000: Incorrect arguments to ESCAPE
CREATE TABLE table_like_t2(x int, y varchar(100));
CREATE INDEX idx ON table_like_t2(y);
INSERT INTO table_like_t2 VALUES (1, 'abcd'), (2, 'ab%cde');
ANALYZE TABLE table_like_t2;
Table	Op	Msg_type	Msg_text
test.table_like_t2	analyze	note	The storage engine for the table doesn't support analyze
EXPLAIN SELECT * FROM table_like_t2 WHERE y LIKE 'abc%%' ESCAPE (SELECT 'c' FROM table_like_t1) ORDER BY y;
id	select_type	table	partitions	type	possible_keys	key	key_len	ref	rows	filtered	Extra
1	PRIMARY	table_like_t2	NULL	ALL	idx	NULL	NULL	NULL	2	50.00	Using where; Using filesort
2	SUBQUERY	table_like_t1	NULL	ALL	NULL	NULL	NULL	NULL	1	100.00	NULL
Warnings:
Note	1003	/* select#1 */ select `test`.`table_like_t2`.`x` AS `x`,`test`.`table_like_t2`.`y` AS `y` from `test`.`table_like_t2` where (`test`.`table_like_t2`.`y` like 'abc%%') order by `test`.`table_like_t2`.`y`
SELECT * FROM table_like_t2 WHERE y LIKE 'abc%%' ESCAPE (SELECT 'c' FROM table_like_t1) ORDER BY y;
x	y
2	ab%cde
DROP TABLE table_like_t1, table_like_t2;
# Bug#20035071: Out of range error in subselect lead to assertion failed
CREATE TABLE table_like_t1(a INTEGER);
SELECT 1 FROM table_like_t1 HAVING (SELECT 1 FROM table_like_t1) LIKE EXP(NOW());
ERROR 22003: DOUBLE value is out of range in 'exp(now())'
DROP TABLE table_like_t1;
